{"type":"config","name":"Optimizing graphql-ruby static validation pipeline","metricName":"total_µs","metricUnit":"µs","bestDirection":"lower"}
{"run":1,"commit":"4434bf5","metric":3118621.6,"metrics":{"introspection_us":481,"abstract_frags_us":242.3,"abstract_frags2_us":377.3,"big_query_us":3823.8,"fields_merge_us":3113697.2},"status":"keep","description":"Baseline: total 3.12s, fields_merge dominates at 3.11s (99.8%)","timestamp":1773418825788,"segment":0}
{"run":2,"commit":"fdfef7e","metric":21740.5,"metrics":{"introspection_us":466.3,"abstract_frags_us":262.8,"abstract_frags2_us":533.5,"big_query_us":4172.3,"fields_merge_us":16305.6},"status":"keep","description":"Deduplicate fields by signature in find_conflicts_within — 143x speedup (3.12s → 21.7ms)","timestamp":1773418902680,"segment":0}
{"run":3,"commit":"40d7df8","metric":20607.9,"metrics":{"introspection_us":437.1,"abstract_frags_us":234.4,"abstract_frags2_us":511.1,"big_query_us":3747.1,"fields_merge_us":15678.2},"status":"keep","description":"Replace Array#& with intersect? in mutually_exclusive?, optimize compared_fragments_key","timestamp":1773419040110,"segment":0}
{"run":4,"commit":"89c1488","metric":19744.9,"metrics":{"introspection_us":463.3,"abstract_frags_us":405.5,"abstract_frags2_us":345,"big_query_us":3816.1,"fields_merge_us":14715},"status":"keep","description":"Fast path for all-same-signature fields: skip group_by when all fields identical","timestamp":1773419134225,"segment":0}
{"type":"config","name":"Optimizing graphql-ruby static validation (realistic workloads)","metricName":"total_µs","metricUnit":"µs","bestDirection":"lower"}
{"run":1,"commit":"16b263f","metric":4465.4,"metrics":{"introspection_us":389.7,"abstract_frags_us":335.8,"abstract_frags2_us":304.4,"big_query_us":3435.5,"fields_merge_us":8754.7},"status":"keep","description":"New baseline with visibility profiles enabled — realistic workloads: 4.5ms total","timestamp":1773419390322,"segment":0}
{"run":2,"commit":"16b263f","metric":4046.1,"metrics":{"introspection_us":462.1,"abstract_frags_us":304.8,"abstract_frags2_us":321.6,"big_query_us":2957.6,"fields_merge_us":8954.7},"status":"checks_failed","description":"Cache fields_and_fragments_from_selection — incorrect, parents affect mutually_exclusive checks","timestamp":1773419617065,"segment":0}
{"run":3,"commit":"c87ae99","metric":4293.8,"metrics":{"introspection_us":505.3,"abstract_frags_us":221,"abstract_frags2_us":317.2,"big_query_us":3250.3,"fields_merge_us":7996.7},"status":"keep","description":"Eliminate redundant field lookups in FieldsAreDefinedOnType, deduplicate arguments call in RequiredArgumentsArePresent","timestamp":1773419836552,"segment":0}
{"run":4,"commit":"9ccd04d","metric":3486.8,"metrics":{"introspection_us":399.1,"abstract_frags_us":259.2,"abstract_frags2_us":334.2,"big_query_us":2494.3,"fields_merge_us":7362.7},"status":"keep","description":"Flatten fragment spreads into single field map — eliminates O(n²) recursive fragment cross-comparison. big_query -23%","timestamp":1773420529053,"segment":0}
{"run":5,"commit":"2dd13e7","metric":3356.8,"metrics":{"introspection_us":388,"abstract_frags_us":208.3,"abstract_frags2_us":332.4,"big_query_us":2428.1,"fields_merge_us":7369.3},"status":"keep","description":"Cache mutually_exclusive? type pair results, reduce array allocations in collect_fields_inner","timestamp":1773420690296,"segment":0}
{"run":6,"commit":"2dd13e7","metric":3515.7,"metrics":{"introspection_us":400,"abstract_frags_us":215,"abstract_frags2_us":348.4,"big_query_us":2552.3,"fields_merge_us":7041},"status":"discard","description":"Inline group_by into collect_fields_inner, skip on_field for leaf nodes — within noise","timestamp":1773420821868,"segment":0}
{"type":"config","name":"Optimizing graphql-ruby static validation (YJIT, visibility profiles)","metricName":"total_µs","metricUnit":"µs","bestDirection":"lower"}
{"run":1,"commit":"f0d9703","metric":2714.4,"metrics":{"introspection_us":747.4,"abstract_frags_us":187.3,"abstract_frags2_us":206,"big_query_us":1573.7,"fields_merge_us":3246.7},"status":"keep","description":"Baseline with YJIT enabled — 2.7ms total (big_query 1.57ms)","timestamp":1773421132732,"segment":0}
{"run":2,"commit":"3292c49","metric":2576.7,"metrics":{"introspection_us":714.7,"abstract_frags_us":186.5,"abstract_frags2_us":204.1,"big_query_us":1471.4,"fields_merge_us":2762},"status":"keep","description":"Inline group_by into collect_fields_inner, skip on_field for leaf fields — big_query ~1.47ms","timestamp":1773421313946,"segment":0}
{"type":"config","name":"Optimizing graphql-ruby static validation (YJIT, visibility profiles, real-world query)","metricName":"total_µs","metricUnit":"µs","bestDirection":"lower"}
{"run":1,"commit":"e7cade1","metric":21911.8,"metrics":{"abstract_frags_us":174.5,"abstract_frags2_us":171.7,"big_query_us":1665.1,"large_query_us":19900.5,"fields_merge_us":2331.7},"status":"keep","description":"Baseline with real-world checkout schema + large_query (~20ms). Primary metric now includes large_query.","timestamp":1773421502491,"segment":0}
{"run":2,"commit":"9edae2a","metric":17529,"metrics":{"abstract_frags_us":233.4,"abstract_frags2_us":189.3,"big_query_us":1719.4,"large_query_us":15386.9,"fields_merge_us":2508.3},"status":"keep","description":"Match production config: did_you_mean(nil), allow_legacy_invalid_return_type_conflicts(false). large_query 15.4ms","timestamp":1773421692353,"segment":0}
{"run":3,"commit":"6ff1ca8","metric":11958.7,"metrics":{"abstract_frags_us":369.6,"abstract_frags2_us":232.6,"big_query_us":1717.4,"large_query_us":9639.1,"fields_merge_us":2387},"status":"keep","description":"Skip all_types loading + did_you_mean dictionary computation when schema.did_you_mean is nil. large_query 9.6ms (was 15.4ms, -37%)","timestamp":1773421900090,"segment":0}
{"run":4,"commit":"6a1736e","metric":11271.1,"metrics":{"abstract_frags_us":326.8,"abstract_frags2_us":236.1,"big_query_us":1755.1,"large_query_us":8953.1,"fields_merge_us":2373},"status":"keep","description":"Optimize add_conflict identity check (avoid expensive AST node #==). large_query 8.95ms. Verified no regression on smaller benchmarks.","timestamp":1773422132046,"segment":0}
{"run":5,"commit":"6a1736e","metric":10822.7,"metrics":{"abstract_frags_us":320.3,"abstract_frags2_us":235.4,"big_query_us":1688.6,"large_query_us":8578.4,"fields_merge_us":2156.7},"status":"discard","description":"Local field def cache in collect_fields_inner — double-caching over Profile, within noise","timestamp":1773422265196,"segment":0}
{"run":6,"commit":"130b244","metric":8496.2,"metrics":{"abstract_frags_us":162.9,"abstract_frags2_us":278.3,"big_query_us":1889.2,"large_query_us":6165.8,"fields_merge_us":2448.3},"status":"keep","description":"Cache collect_fields results in find_conflicts_between_sub_selection_sets — avoids re-expanding same sub-selections. large_query ~6.2ms (was ~9ms)","timestamp":1773422466536,"segment":0}
{"run":10,"commit":"ae976fa","metric":8733.3,"metrics":{"abstract_frags_us":187.8,"abstract_frags2_us":259.7,"big_query_us":1956.9,"large_query_us":6328.9,"fields_merge_us":2309.3},"status":"keep","description":"Fast path in FieldsHaveAppropriateSelections for common case (non-nil, non-leaf type with selections). Avoids kind/leaf checks on hot path.","timestamp":1773424292831,"segment":0}
{"run":11,"commit":"0020699","metric":8312.4,"metrics":{"abstract_frags_us":334.6,"abstract_frags2_us":194.7,"big_query_us":1523.9,"large_query_us":6259.2,"fields_merge_us":2155.3},"status":"keep","description":"Avoid forwardable delegation overhead: use @object_types directly in FragmentSpreadsArePossible and FragmentsAreOnCompositeTypes. Eliminates redundant types.type() lookups.","timestamp":1773424470713,"segment":0}
{"run":12,"commit":"197169e","metric":8493.1,"metrics":{"abstract_frags_us":310.6,"abstract_frags2_us":200.8,"big_query_us":1598,"large_query_us":6383.7,"fields_merge_us":2287.3},"status":"keep","description":"Eliminate redundant type lookups: FragmentTypesExist uses @object_types.last instead of @types.type(). Cache max_errors in FieldsWillMerge to avoid delegation.","timestamp":1773424623803,"segment":0}
{"run":15,"commit":"cc18b19","metric":7934.6,"metrics":{"abstract_frags_us":170.6,"abstract_frags2_us":471.4,"big_query_us":1375.1,"large_query_us":5917.5,"fields_merge_us":2295},"status":"keep","description":"Cache return_type and unwrapped_return_type on Field struct — avoids repeated Schema::Field#type and Wrapper#unwrap calls in find_conflict and find_conflicts_between_sub_selection_sets","timestamp":1773427453997,"segment":0}
{"type":"config","name":"Optimizing graphql-ruby static validation (pure validation, no Query/Profile creation)","metricName":"total_µs","metricUnit":"µs","bestDirection":"lower"}
{"run":3,"commit":"3270b86","metric":4651.5,"metrics":{"abstract_frags_us":237.7,"abstract_frags2_us":96.5,"big_query_us":848.5,"large_query_us":3468.8,"fields_merge_us":1852.6},"status":"keep","description":"Cache complete Profile#field result per (owner, field_name) — eliminates repeated kind checks, parent lookups, and visibility checks on warm cache. Universal win across all workloads.","timestamp":1773428039402,"segment":0}
{"run":4,"commit":"6b88caa","metric":4152.9,"metrics":{"abstract_frags_us":236.9,"abstract_frags2_us":86,"big_query_us":815.9,"large_query_us":3014.1,"fields_merge_us":1844},"status":"keep","description":"Cache Profile#type result per type_name — eliminates repeated get_type + visibility + referenced? checks. All workloads improve.","timestamp":1773428201358,"segment":0}
{"run":5,"commit":"4d05c20","metric":4090.7,"metrics":{"abstract_frags_us":246.8,"abstract_frags2_us":88,"big_query_us":794.6,"large_query_us":2961.3,"fields_merge_us":1823.6},"status":"keep","description":"Cache Wrapper#unwrap result — type wrappers are schema-level objects so this benefits all queries permanently. Eliminates recursive unwrap on repeated field visits.","timestamp":1773428371403,"segment":0}
{"run":10,"commit":"86f2005","metric":4068.7,"metrics":{"abstract_frags_us":244.5,"abstract_frags2_us":86,"big_query_us":802,"large_query_us":2936.2,"fields_merge_us":1900},"status":"keep","description":"Inline push_type into on_field/on_operation_definition/on_fragment_with_type — removes method indirection, simplifies code","timestamp":1773429365097,"segment":0}
{"run":11,"commit":"9248900","metric":4056.3,"metrics":{"abstract_frags_us":241.4,"abstract_frags2_us":86.9,"big_query_us":803.8,"large_query_us":2924.2,"fields_merge_us":1863.8},"status":"keep","description":"Cache inline fragment path strings per type name — deduplicates ~500 string allocations per validation for queries with many inline fragments","timestamp":1773429510668,"segment":0}
{"run":12,"commit":"c3d8880","metric":4231.9,"metrics":{"abstract_frags_us":243.1,"abstract_frags2_us":87.6,"big_query_us":797.6,"large_query_us":3103.6,"fields_merge_us":1889},"status":"keep","description":"Cache to_type_signature on NonNull and List wrappers — schema-level memoization, eliminates repeated string building","timestamp":1773429627592,"segment":0}
{"run":13,"commit":"c3d8880","metric":4160.2,"metrics":{"abstract_frags_us":256.4,"abstract_frags2_us":88.7,"big_query_us":817.6,"large_query_us":2997.5,"fields_merge_us":1778},"status":"discard","description":"No code change — verification run showing stable performance at ~4160µs","timestamp":1773429912614,"segment":0}
{"run":14,"commit":"be788ac","metric":3561.9,"metrics":{"abstract_frags_us":62,"abstract_frags2_us":78.5,"big_query_us":780,"large_query_us":2641.4,"fields_merge_us":1780.9},"status":"keep","description":"Fresh before/after: TOTAL realistic 7650→3562µs (-53%), large_query 5991→2641µs (-56%), big_query 1477→780µs (-47%), fields_merge 1.8s→1.8ms (-99.9%). Higher iteration counts + 3-trial median for accuracy.","timestamp":1773430174832,"segment":0}
{"run":15,"commit":"be788ac","metric":4124.9,"metrics":{"abstract_frags_us":235.4,"abstract_frags2_us":85.9,"big_query_us":807.6,"large_query_us":2996,"fields_merge_us":1889.4},"status":"discard","description":"Baseline verification after context resume — stable at ~4100-4200µs on autoresearch.sh","timestamp":1773430386852,"segment":0}
{"run":16,"commit":"be788ac","metric":4078.5,"metrics":{"abstract_frags_us":248.1,"abstract_frags2_us":87.9,"big_query_us":803.2,"large_query_us":2939.3,"fields_merge_us":1857},"status":"checks_failed","description":"Memoize Schema::Field#type for resolver_class path — breaks test because resolver class can be mutated after field creation; type must reflect latest state","timestamp":1773430753938,"segment":0}
{"run":17,"commit":"49e8ad2","metric":3967.1,"metrics":{"abstract_frags_us":230.1,"abstract_frags2_us":85.8,"big_query_us":803.4,"large_query_us":2847.8,"fields_merge_us":1775.2},"status":"keep","description":"Skip empty iteration in visitor: guard arguments/directives/selections with empty? check before iterating. Avoids ~6000 empty .each calls per validation in large_query.","timestamp":1773430942340,"segment":0}
{"run":18,"commit":"d4dddcb","metric":3997.1,"metrics":{"abstract_frags_us":248.3,"abstract_frags2_us":85,"big_query_us":794.3,"large_query_us":2869.5,"fields_merge_us":1631.2},"status":"keep","description":"Cache field_definition.type.unwrap per Schema::Field in visitor — avoids repeated type+unwrap dispatch chain. Bigger win for resolver-class schemas where Field#type isn't memoized.","timestamp":1773431101609,"segment":0}
{"run":19,"commit":"7709c19","metric":3959.8,"metrics":{"abstract_frags_us":255.4,"abstract_frags2_us":84.9,"big_query_us":789.7,"large_query_us":2829.8,"fields_merge_us":1451},"status":"keep","description":"Replace Field Struct with plain class — plain class initialization is ~1.7x faster than Struct.new with YJIT. Saves ~2600 struct allocations per validation. fields_merge improves most (5000 Field objects).","timestamp":1773431351852,"segment":0}
{"run":20,"commit":"5836843","metric":4191,"metrics":{"abstract_frags_us":258.8,"abstract_frags2_us":88.3,"big_query_us":843.4,"large_query_us":3000.5,"fields_merge_us":1499},"status":"keep","description":"Reduce method dispatch overhead: use @types directly instead of context.types/context.query.types in FieldsWillMerge, RequiredArgumentsArePresent, VariablesAreInputTypes. Cache context.fragments in @fragments.","timestamp":1773431742791,"segment":0}
{"run":21,"commit":"fbe1796","metric":4154.6,"metrics":{"abstract_frags_us":238.2,"abstract_frags2_us":84.6,"big_query_us":822.3,"large_query_us":3009.5,"fields_merge_us":1460.6},"status":"keep","description":"Cache required argument names per field definition in RequiredArgumentsArePresent — avoids re-iterating arguments for the same definition across field instances","timestamp":1773431927123,"segment":0}
{"run":22,"commit":"da47c32","metric":4059.6,"metrics":{"abstract_frags_us":257.3,"abstract_frags2_us":90.4,"big_query_us":816.3,"large_query_us":2895.6,"fields_merge_us":1395.2},"status":"keep","description":"Replace @field_definitions stack with @current_field_definition variable — eliminates push/pop per field visit (2247+ per validation). Uses simple variable assignment instead of array operations.","timestamp":1773432062068,"segment":0}
{"run":23,"commit":"de4a70f","metric":3906.5,"metrics":{"abstract_frags_us":237.3,"abstract_frags2_us":84,"big_query_us":785.3,"large_query_us":2799.9,"fields_merge_us":1374.6},"status":"keep","description":"Replace @directive_definitions stack with @current_directive_definition variable — same pattern as field_definitions, eliminates push/pop for directives","timestamp":1773432179346,"segment":0}
{"run":24,"commit":"b2f8a23","metric":3990.4,"metrics":{"abstract_frags_us":247.4,"abstract_frags2_us":85,"big_query_us":801.5,"large_query_us":2856.5,"fields_merge_us":1395.8},"status":"keep","description":"Remove dead @directives array initialization","timestamp":1773432260103,"segment":0}
{"run":25,"commit":"cb0c123","metric":3898,"metrics":{"abstract_frags_us":246,"abstract_frags2_us":83.8,"big_query_us":798,"large_query_us":2770.2,"fields_merge_us":1400},"status":"keep","description":"Replace @argument_definitions stack with @current/@parent_argument_definition variables — uses Ruby call stack for save/restore instead of Array push/pop. Handles arbitrary nesting depth correctly. Matters for argument-heavy queries.","timestamp":1773432398000,"segment":0}
{"run":29,"commit":"400a24c","metric":3929.8,"metrics":{"abstract_frags_us":248.9,"abstract_frags2_us":84.1,"big_query_us":787.8,"large_query_us":2809,"fields_merge_us":1352.8},"status":"keep","description":"Inline setting_errors block into on_field and on_operation_definition — eliminates 379 block closure allocations per validation","timestamp":1773433000162,"segment":0}
{"run":30,"commit":"3f09198","metric":3700.4,"metrics":{"abstract_frags_us":246.4,"abstract_frags2_us":84.8,"big_query_us":752.8,"large_query_us":2616.4,"fields_merge_us":1497},"status":"keep","description":"Skip FieldsWillMerge conflict check for fields whose direct selections are all unaliased, unique-named Fields with no fragments — avoids collect_fields+find_conflicts_within for ~55% of non-leaf fields","timestamp":1773433182674,"segment":0}
{"run":31,"commit":"1cf9afd","metric":3806.2,"metrics":{"abstract_frags_us":242.9,"abstract_frags2_us":86.5,"big_query_us":772.9,"large_query_us":2703.9,"fields_merge_us":1483.6},"status":"keep","description":"Inline field_definition accessor to @current_field_definition in RequiredArgumentsArePresent — avoids one method dispatch per field","timestamp":1773433299378,"segment":0}
{"run":32,"commit":"6417eb0","metric":3886.7,"metrics":{"abstract_frags_us":259.6,"abstract_frags2_us":86.3,"big_query_us":785.1,"large_query_us":2755.7,"fields_merge_us":1506.8},"status":"keep","description":"Inline type_definition to @current_object_type in FieldsWillMerge on_field and on_operation_definition","timestamp":1773433350643,"segment":0}
{"run":33,"commit":"e22588e","metric":3741.9,"metrics":{"abstract_frags_us":257.6,"abstract_frags2_us":82.4,"big_query_us":746.8,"large_query_us":2655.1,"fields_merge_us":1322},"status":"keep","description":"Replace @path push/pop with indexed array + depth counter — pre-allocated Array.new(32) with @path_depth tracking eliminates Array#push/#pop overhead for ~5500 path operations per validation","timestamp":1773433528620,"segment":0}
{"run":34,"commit":"e22588e","metric":3721,"metrics":{"abstract_frags_us":248.5,"abstract_frags2_us":80.5,"big_query_us":750.2,"large_query_us":2641.8,"fields_merge_us":1314.2},"status":"discard","description":"Verification run — stable at ~3720-3880µs","timestamp":1773433586259,"segment":0}
{"run":35,"commit":"7e391a7","metric":3740.1,"metrics":{"abstract_frags_us":248.1,"abstract_frags2_us":85,"big_query_us":751.2,"large_query_us":2655.8,"fields_merge_us":1318},"status":"keep","description":"Inline on_fragment_with_type into on_inline_fragment and on_fragment_definition — eliminates yield/block overhead and method dispatch for 531 fragment callbacks per validation","timestamp":1773433705645,"segment":0}
{"run":36,"commit":"7e391a7","metric":3841.3,"metrics":{"abstract_frags_us":268.2,"abstract_frags2_us":88.9,"big_query_us":773.6,"large_query_us":2710.6,"fields_merge_us":1339.8},"status":"discard","description":"Final verification — stable at ~3740-3880µs on autoresearch.sh, ~3000µs on compare_validation.rb","timestamp":1773433794955,"segment":0}
{"run":37,"commit":"0fbfb73","metric":3719.9,"metrics":{"abstract_frags_us":239,"abstract_frags2_us":85.8,"big_query_us":751,"large_query_us":2644.1,"fields_merge_us":1349.2},"status":"keep","description":"Fix fast path in validate_field_selections: cover both common cases (leaf+no-selections ~70%, non-leaf+selections ~16%). Previous fast path only caught 16%. Now covers 86% of fields.","timestamp":1773434023618,"segment":0}
{"run":38,"commit":"0fbfb73","metric":4176.9,"metrics":{"abstract_frags_us":242.4,"abstract_frags2_us":84,"big_query_us":750.1,"large_query_us":3100.4,"fields_merge_us":1286.2},"status":"discard","description":"Cache selections_may_conflict? per selections array — hash lookup overhead exceeds computation savings, regression","timestamp":1773434172299,"segment":0}
{"run":39,"commit":"0fbfb73","metric":3834.7,"metrics":{"abstract_frags_us":272.9,"abstract_frags2_us":87.6,"big_query_us":791.4,"large_query_us":2682.8,"fields_merge_us":1558.2},"status":"discard","description":"Lazy visited_fragments hash in collect_fields — avoids hash alloc for fragment-free selection sets, but within noise on benchmarks","timestamp":1773434441594,"segment":0}
{"run":40,"commit":"0fbfb73","metric":4067.1,"metrics":{"abstract_frags_us":236.4,"abstract_frags2_us":83,"big_query_us":746.6,"large_query_us":3001.1,"fields_merge_us":1438.6},"status":"discard","description":"Cache single-element parent arrays per type + freeze + EMPTY_PARENTS constant — extra branching outweighs allocation savings, large_query regression","timestamp":1773434600647,"segment":0}
{"run":41,"commit":"65045d4","metric":3304.6,"metrics":{"abstract_frags_us":236.2,"abstract_frags2_us":82.8,"big_query_us":747.9,"large_query_us":2237.7,"fields_merge_us":2689.4},"status":"keep","description":"Defer array wrapping in collect_fields_inner — store single Field directly in response_keys, only wrap in array on collision. Saves ~1200 array allocations (85% of response keys are single-field). large_query -15%.","timestamp":1773434851450,"segment":0}
{"run":42,"commit":"65045d4","metric":3304.5,"metrics":{"abstract_frags_us":247.7,"abstract_frags2_us":83.4,"big_query_us":725.7,"large_query_us":2247.7,"fields_merge_us":2723.8},"status":"discard","description":"Verification run — stable at 3304µs. compare_validation confirms 2731µs realistic, fields_merge 1365µs (no regression)","timestamp":1773434903018,"segment":0}
