{"run":43,"commit":"65045d4","metric":3668.1,"metrics":{"abstract_frags_us":257,"abstract_frags2_us":82.1,"big_query_us":748.9,"large_query_us":2580.1,"fields_merge_us":1759.4},"status":"discard","description":"Replace Forwardable delegation with inline methods in NodeWithPath — within noise range","timestamp":1773435284395,"segment":0}
{"run":44,"commit":"65045d4","metric":3757.3,"metrics":{"abstract_frags_us":243.4,"abstract_frags2_us":77.5,"big_query_us":745.7,"large_query_us":2690.7,"fields_merge_us":1314},"status":"discard","description":"PendingField deferred definition lookup — extra is_a? branching and promotion overhead exceeds savings from deferring @types.field for non-colliding entries","timestamp":1773439566717,"segment":0}
{"run":45,"commit":"65045d4","metric":3322.8,"metrics":{"abstract_frags_us":248.5,"abstract_frags2_us":80.9,"big_query_us":733.3,"large_query_us":2260.1,"fields_merge_us":2831},"status":"discard","description":"Lazy LiteralValidator — only saves ~1µs per-request init, not worth the complexity","timestamp":1773439658612,"segment":0}
{"run":46,"commit":"e74cf11","metric":3140.2,"metrics":{"abstract_frags_us":228.7,"abstract_frags2_us":77.8,"big_query_us":690.1,"large_query_us":2143.6,"fields_merge_us":2871},"status":"keep","description":"Lazy visited_fragments hash in collect_fields — pass nil, only allocate on first fragment spread encounter. Saves ~200 hash allocations for fragment-free selection sets.","timestamp":1773439865770,"segment":0}
